"","tmp_topic","tmp_posterior[1:20, 2]","abstract","doc_info","keywords","year","publication","authors","title"
"23","Topic_4",0.426086956521739,"The concept of Product Service Systems (PSS) allows companies to offer customer focused products by matching classical product concepts with service concepts. This results in new challenges for the development phase. This publication aims to deduce and discuss a generic PSS development process. Therefore product and service development processes were analyzed and combined to a PSS development process. In its development, a PSS confronts the developer with new challenges. Most of these challenges can be assigned to a certain phase in the development, while some of them appear in the entire life-cycle of a PSS. During this research, it was the aim to match the detected challenges of PSS with methods that have been developed for supporting PSS development. The PSS development process, its challenges and methods are finally applied on a PSS case.","Uwe Moser, Sebastian Maisenbacher, Daniel Kasperek, Maik Maurer, Definition of an Approach for the Development of Product-Service Systems, Procedia CIRP, Volume 30, 2015, Pages 18-23, ISSN 2212-8271, http://dx.doi.org/10.1016/j.procir.2015.02.130.


(http://www.sciencedirect.com/science/article/pii/S2212827115004436)","product-service system; development process; supporting methods; problems and challenges; design methodologies","2015","Procedia CIRP","Uwe Moser; Sebastian Maisenbacher; Daniel Kasperek; Maik Maurer","Definition of an Approach for the Development of Product-Service Systems"
"702","Topic_4",0.424460431654676,"Agility in the sense of changeability on the manufacturing network level, and here especially the business perspective, has received less attention than the other dimensions of changeability on the lower production levels, as well as in relation to the technological perspective. The present paper aims to enrich the concept of agility in the aforementioned sense, taking strategic management concepts into account that have so far received less attention in relation to changeability. Namely, we consider the concepts of lead factory, capacity pooling and allying, operational flexibility, and the concept of combining products, services and software as fruitful enrichments of the umbrella concept changeability. In so doing, we highlight interdependencies between agility and the analyzed concepts as well as the other changeability dimensions on the lower production level of factories or sites. On this basis, we formulate six hypotheses in consideration of the presented theoretical derivations. Hence, the methodological approach of our research is conceptual and hypothesis generating. Our work is supposed to build the basis for continuative conceptual and empirical research on agility.","M. Mikusz, D. Heber, C. Katzfu√ü, M. Monauni, T. Tauterat, Changeable Manufacturing on the Network Level, Procedia CIRP, Volume 41, 2016, Pages 27-32, ISSN 2212-8271, http://dx.doi.org/10.1016/j.procir.2015.12.012.


(http://www.sciencedirect.com/science/article/pii/S2212827115010914)","Changeable manufacturing; Agility; Manufacturing network","2016","Procedia CIRP","M. Mikusz; D. Heber; C. Katzfu√ü; M. Monauni; T. Tauterat","Changeable Manufacturing on the Network Level"
"348","Topic_4",0.422018348623853,"In the globally competitive market landscape, companies, in order to remain sustainable, must shift their focus towards constantly improving their PSS offerings by incorporating lean thinking approaches. PSS are complex, dynamic, and multi-dimensional systems, which are supported by appropriate infrastructure and networks. At the same time, PSS require robust engineering methods and tools for their design, which allow multi-dimensional exchange of knowledge between the designers and the relevant stakeholders across the value chain. Currently, enabling technologies such as Cloud technology, social media and networking, knowledge management, and context sensitivity present new possibilities to enhance the knowledge exchange and the collaborative process of PSS design. These technologies allow the gathering and analysis of big volumes of data from scattered heterogeneous IT systems and, at the same time, allow PSS design improvements by processing the experiences of the business customers, consumers, designers, shop-floor, and provide feedback to the design phase. However, a number of challenges are encountered during the gathering, visualization, monitoring, and assessment of related data, such as the lack of context sensitivity. Simultaneously, PSS evaluation approaches are still immature and there is limited work that correlates the impact of the entire PSS lifecycle with the performance assessment of the PSS design. The present work includes a review of the aforementioned technologies from academic, market, and industrial perspectives. Based on an extensive literature review and on constructive discussions with three European SMEs, several barriers and limitations of adopting the aforementioned technologies in practice are identified. Finally, a conceptual eco-innovative framework for lean PSS design is presented, explaining how these technologies could be combined for the improvements of PSS design and evaluation procedures.","Dimitris Mourtzis, Sophia Fotia, Marta Gamito, Rui Neves-Silva, Ana Correia, Philipp Spindler, Giuditta Pezzotta, Monica Rossi, PSS Design Considering Feedback from the Entire Product-service Lifecycle and Social Media, Procedia CIRP, Volume 47, 2016, Pages 156-161, ISSN 2212-8271, http://dx.doi.org/10.1016/j.procir.2016.03.092.


(http://www.sciencedirect.com/science/article/pii/S2212827116300622)","Lean PSS; Social-media Networking; Context Sensitivity","2016","Procedia CIRP","Dimitris Mourtzis; Sophia Fotia; Marta Gamito; Rui Neves-Silva; Ana Correia; Philipp Spindler; Giuditta Pezzotta; Monica Rossi","PSS Design Considering Feedback from the Entire Product-service Lifecycle and Social Media"
"150","Topic_4",0.416,"We propose a new generic design methodology for different types of PSS. Product Service System (PSS) has received much attention recently from academia and industry because of its benefits. PSS can provide customers values and functionalities, as well as physical products, to fulfill economic, social and environmental goals.Many methodologies have been proposed for designing PSSs. Most of the existing methodologies are domain specific and were proposed to solve specific problems in certain projects. Some methodologies are generic but they provide neither guideline to practitioners and designers nor reflect the differences in various PSS types. As a generic approach to guide practitioners and designers in designing PSS effectively, the proposed methodology also takes into account user in-volvement, business model and organizational structure. The proposed methodology is demonstrated through design examples of different types of PSSs.","Tuan A. Tran, Joon Y. Park, Development of integrated design methodology for various types of product ??service systems, Journal of Computational Design and Engineering, Volume 1, Issue 1, January 2014, Pages 37-47, ISSN 2288-4300, http://dx.doi.org/10.7315/JCDE.2014.004.


(http://www.sciencedirect.com/science/article/pii/S2288430014500048)","PSS; Product service system; Design methodology; Product service integration; Integrated design methodology","2014","Journal of Computational Design and Engineering","Tuan A. Tran; Joon Y. Park","Development of integrated design methodology for various types of product ??service systems"
"35","Topic_4",0.414814814814815,"Companies are increasingly selling functionalities of integrated solutions of products and services instead of selling mere products. This integration of products and service solutions is known as Product Service System (PSS), which allows to maximize customer value and overcome increasing competition in the manufacturing sector. In this sense, PSS designers require adapted tools to support the design of sustainable solutions. This article aims to address this question by proposing a methodological framework for integrating sustainability considerations into the PSS design process. To this end a review of the peculiarities of the PSS design process was performed and which aims to explore potential ways of integrating sustainability considerations within PSS design. Several requirements have been drawn from PSS design and sustainability literature which contributed towards the formalization of a methodological framework supporting the design of sustainable PSS.","B. Doualle, K. Medini, X. Boucher, D. Brissaud, V. Laforest, Design of Sustainable Product-service Systems (PSS): Towards an Incremental Stepwise Assessment Method, Procedia CIRP, Volume 48, 2016, Pages 152-157, ISSN 2212-8271, http://dx.doi.org/10.1016/j.procir.2016.04.074.


(http://www.sciencedirect.com/science/article/pii/S221282711630261X)","Product-Service System (PSS); Sustainable Assessment; Design Process","2016","Procedia CIRP","B. Doualle; K. Medini; X. Boucher; D. Brissaud; V. Laforest","Design of Sustainable Product-service Systems (PSS): Towards an Incremental Stepwise Assessment Method"
"68","Topic_4",0.412280701754386,"Product Service Systems (PSS) has been regarded as an attractive business concept that create high added value by integrated provisions of products and services.Since both products and services are included in the design object, the PSS design process has become increasingly complicated. Thus, the designers need to organize reliably what they should accomplish during the PSS design process. However, it is difficult for designers to grapple what they need to focus on during PSS design process. To support such PSS design process, this paper proposes a PSS design guideline which based on Software Engineering Methods and Theory (SEMAT). The proposed guideline provides the designerswithPSS design perspective, milestones through the design process, and the way to manage the design process.","Keita Muto, Koji Kimita, Yoshiki Shimomura, A Guideline for Product-Service-Systems Design Process, Procedia CIRP, Volume 30, 2015, Pages 60-65, ISSN 2212-8271, http://dx.doi.org/10.1016/j.procir.2015.02.188.


(http://www.sciencedirect.com/science/article/pii/S2212827115005041)","Product-Service Systems(PSS); Design guideline; SEMAT","2015","Procedia CIRP","Keita Muto; Koji Kimita; Yoshiki Shimomura","A Guideline for Product-Service-Systems Design Process"
"20","Topic_4",0.408071748878924,"For modern manufacturing companies, the combination of physical products and intangible services (called Product-Service Systems or PSS) has been proved by time to be useful to enhance the product features by adding value throughout new functionalities, and bringing competitive advantages in a specific target market. Through PSS, companies create new business opportunities, extend the market share, differentiate the product portfolio, and improve sustainability. The PSS approach shifts the company attention from producing physical products to offering integrated systems. However, ideating and designing a PSS is a complex and multifaceted process, which requires multiple competences and cross-functions cooperation within the manufacturing company. In fact, the design phase requires to simultaneous dal with the characteristics of the physical product and of the intangible services, the last ones being by their nature fuzzy and difficult to define. Furthermore, the two entities have to be synergistically delivered and strategically managed thanks to the adoption of a PSS lifecycle management methodology and tools, in particular for the creation of a proper PSS infrastructure to delivery and maintain all the components from the design to the end of life phases. Several methodologies to design PSS can be found in literature. Most of them focus on technical development stages, while some of them face also the innovation aspects and sustainability. However, traditional product-centered approaches are not able to fully support the processes that manufacturing companies have to put in place for creating PSSs. This paper presents a new approach, based on the combination of the Open innovation method with IT solutions supporting information sharing and intra-team cooperation, in that any manufacturing company could adopt to manage the design process of a PSS. In particular, the methodology and the tools are focused on the early stages of the PSS design process, as Ideation and Concept definition that have been developed within the European FP7 project FLEXINET.","Eugenia Marilungo, Eva Coscia, Angelo Quaglia, Margherita Peruzzini, Michele Germani, Open Innovation for Ideating and Designing New Product Service Systems, Procedia CIRP, Volume 47, 2016, Pages 305-310, ISSN 2212-8271, http://dx.doi.org/10.1016/j.procir.2016.03.214.


(http://www.sciencedirect.com/science/article/pii/S2212827116304395)","Product Service System (PSS); PSS Design; Product Service Lyfecycle Management (PSLM); Open Innovation","2016","Procedia CIRP","Eugenia Marilungo; Eva Coscia; Angelo Quaglia; Margherita Peruzzini; Michele Germani","Open Innovation for Ideating and Designing New Product Service Systems"
"33","Topic_4",0.405172413793103,"Despite the growing research interest in PSS design and development methods in recent years, there is still no fully stabilized and shared understanding of the PSS design process. This can be partly explained by two main gaps: the decoupled design of product and services and the lack of operational solutions. This research aims at outlining the main characteristics of a proposal for a new PSS design framework, expected to contribute answering these 2 gaps. The proposition is based jointly on a recently created PSS design methodology and an extension of the functional analysis (FA) approach (NF X 50-100), which is commonly used in product design. The proposed framework intends to smoothly integrate the whole PSS design process, including product-service design and the network configuration.","Hery Andriankaja, Xavier Boucher, Khaled Medini, Herv√© Vaillant, A Framework to Design Integrated Product-Service Systems Based on the Extended Functional Analysis Approach, Procedia CIRP, Volume 47, 2016, Pages 323-328, ISSN 2212-8271, http://dx.doi.org/10.1016/j.procir.2016.03.080.


(http://www.sciencedirect.com/science/article/pii/S2212827116300506)","Product-service system (PSS); design method; functional analysis (FA) approach; PSS global offer; PSS value network","2016","Procedia CIRP","Hery Andriankaja; Xavier Boucher; Khaled Medini; Herv√© Vaillant","A Framework to Design Integrated Product-Service Systems Based on the Extended Functional Analysis Approach"
"530","Topic_5",0.611353711790393,"Life Cycle Analysis (LCA) is a methodological framework that estimates environmental impacts of products, systems or services in a life cycle perspective (from cradle to grave) at local to global levels. Some environmental impacts can vary depending on the characteristics of their surroundings, and therefore on the location of the activity. This variability can be taken into account in environmental assessment using spatialized LCA. Spatial differentiation is especially relevant when studying territories (ca. 100??0,000¬†km2), which often have high heterogeneity in environmental characteristics. In this study, we developed a method for spatialized territorial LCA (STLCA) that combines spatialized LCA and territorial LCA to study land-use planning in an agricultural territory. An agricultural territory is defined as a geographically delimited area in which the majority of land use or economic activity is based on agriculture. STLCA can estimate potential environmental impacts of an agricultural territory for land-planning purposes, such as which agricultural activities should be developed and where to locate them. The method consists of six steps: (1) defining boundaries and functions of the territory under study and identifying the human activities to include, (2) defining and locating activity and environment typologies within the territory, (3) determining the spatialized life cycle inventory by locating emissions using regional data, if possible, (4) determining spatialized life cycle impact assessment for all regional impacts considered, (5) mapping impacts inside and outside the territory, and finally (6) analyzing results using sensitivity and uncertainty analysis. Objectives of this method are to (1) give more accurate results than a territorial LCA without spatial differentiation, (2) help decrease environmental impacts within a territory while avoiding transfer of impacts to other territories and (3) help avoid or minimize impacts of exchanges of resources or products with other territories.","Laure Nitschelm, Jo√´l Aubin, Michael S. Corson, Val√©rie Viaud, Christian Walter, Spatial differentiation in Life Cycle Assessment LCA applied to an agricultural territory: current practices and method development, Journal of Cleaner Production, Volume 112, Part 4, 20 January 2016, Pages 2472-2484, ISSN 0959-6526, http://dx.doi.org/10.1016/j.jclepro.2015.09.138.


(http://www.sciencedirect.com/science/article/pii/S0959652615013785)","Life Cycle Assessment; Territory; Spatial differentiation; Agriculture","2016","Journal of Cleaner Production","Laure Nitschelm; Jo√´l Aubin; Michael S. Corson; Val√©rie Viaud; Christian Walter","Spatial differentiation in Life Cycle Assessment LCA applied to an agricultural territory: current practices and method development"
"626","Topic_5",0.609271523178808,"Life Cycle Analysis (LCA) is an acknowledged method to assess the contribution of livestock production to greenhouse gas (GHG) emissions. Most LCA studies so far allocate GHG emissions of livestock to marketable outputs. Smallholder systems, however, provide several products and services besides the production of marketable products. We explored how to account for multi-functionality within the LCA method in a case of smallholder milk production in the Kaptumo area in Kenya. Expressed per kg of milk, GHG emissions were 2.0 (0.9??.3) kg CO2-e, respectively in case of food allocation, 1.6 (0.8??.9) kg CO2-e in case of economic function allocation and 1.1 (0.5??.7) kg CO2-e in case of livelihood allocation. The two Carbon Footprint (CF) estimates of milk production considering multi-functionality were comparable to CF estimates of milk in intensive milk production systems. Future LCA's of smallholder systems should account for multi-functionality, because CF results and consequently mitigation options change depending on the functions included.","Viola Weiler, Henk MJ Udo, Theo Viets, Todd A Crane, Imke JM De Boer, Handling multi-functionality of livestock in a life cycle assessment: the case of smallholder dairying in Kenya, Current Opinion in Environmental Sustainability, Volume 8, October 2014, Pages 29-38, ISSN 1877-3435, http://dx.doi.org/10.1016/j.cosust.2014.07.009.


(http://www.sciencedirect.com/science/article/pii/S1877343514000426)","Smart meters; Smart meter enabled services; Automation; Consumer Acceptance; Consumer engagement","2014","Current Opinion in Environmental Sustainability","Viola Weiler; Henk MJ Udo; Theo Viets; Todd A Crane; Imke JM De Boer","Handling multi-functionality of livestock in a life cycle assessment: the case of smallholder dairying in Kenya"
"768","Topic_5",0.569506726457399,"Nowadays industrial parks have played a massive role in promoting regional economic development. However, due to intensive industrial activities and enormous energy consumption, industrial parks have become the main areas for pollution emissions. China has carried out the National Demonstration Eco-industrial Parks program to solve such challenges. Industrial symbiosis is the kernel of industrial ecological construction. It aims at promoting several companies to gather in a same geographical site to share services, utility, and by-products in order to decrease environmental impacts of their industrial activities. However how to quantify the impact of industrial symbiosis on improving the sustainability of an industrial park is rarely studied. This study proposed an emergy analysis to conduct an assessment on Hefei economic and technological development area to quantify the performance of industrial symbiosis. Comparing with conventional evaluation methods, emergy analysis can reflect the real contribution of local ecosystem by focusing on nature's free investment, not only the economic value or the resources supplied to the industrial system. Research results show that industrial symbiosis operations improve the study area's sustainable development ability by 33%. Specifically, non-renewable inputs, imported resource inputs, and associated services could be saved by 99.71%, 25.64%, and 9.82%, and the ratio of the money saving to the total gross domestic product of the industrial park would be 29.71%. By examining industrial symbiosis practices in detail within the system, this paper can describe the process of the industrial symbiosis and how these industrial symbiosis practices influence the overall performance of the industrial park. This study indicates that industrial symbiosis could effectively reduce raw materials and energy consumption and improve the overall sustainability, which can help policy-makers make decisions.","Yupeng Fan, Qi Qiao, Lin Fang, Yang Yao, Emergy analysis on industrial symbiosis of an industrial park ??A case study of Hefei economic and technological development area, Journal of Cleaner Production, Volume 141, 10 January 2017, Pages 791-798, ISSN 0959-6526, http://dx.doi.org/10.1016/j.jclepro.2016.09.159.


(http://www.sciencedirect.com/science/article/pii/S0959652616315001)","Emergy analysis; Hefei; Industrial symbiosis; Eco-industrial park construction; Sustainability","2017","Journal of Cleaner Production","Yupeng Fan; Qi Qiao; Lin Fang; Yang Yao","Emergy analysis on industrial symbiosis of an industrial park ??A case study of Hefei economic and technological development area"
"767","Topic_5",0.566137566137566,"As one of important building materials, the sustainability of cement production is widely concerned in the world. This research evaluated the sustainability of China?ôs cement industry in 2010 using emergy analysis. Several emergy based indicators were adopted to describe the comprehensive performance of this system from different angles, including Percentage of renewability (%R), Unit emergy value (UEV), Emergy yield ratio (EYR), Emergy exchange ratio (EER), Environmental load ratio (ELR) and Emergy sustainable index (ESI). The research results show that (1) Mineral resources have absolute contribution to China?ôs cement production; (2) Coal is the main energy source for China?ôs cement industry; (3) China?ôs cement industry has relatively weak competition ability due to relatively high ratio of purchased inputs; (4) China?ôs other industries have benefited greatly from this industry by exchanges; (5) China?ôs cement industry cannot keep sustainable in the long run due to its high environmental load; (6) the UEV of Chinese cement in 2010 is 3.64E15 sej/t (based on the emergy baseline 15.83E24 sej/yr). Finally, the related policy implications are proposed from four aspects, including (1) Accelerating the adjustment of process structure and technical innovation; (2) Promoting the substitution of raw materials or fuels; (3) Raising the price of cement products; (4) Decreasing the export of cement products.","Xiaohong Zhang, Jianming Shen, Yanqing Wang, Yan Qi, Wenjie Liao, Wei Shui, Li Li, Hui Qi, Xiaoyu Yu, An environmental sustainability assessment of China?ôs cement industry based on emergy, Ecological Indicators, Volume 72, January 2017, Pages 452-458, ISSN 1470-160X, http://dx.doi.org/10.1016/j.ecolind.2016.08.046.


(http://www.sciencedirect.com/science/article/pii/S1470160X16305076)","China?ôs cement industry; Emergy analysis; Resource efficiency; Environmental load; Comprehensive performance","2017","Ecological Indicators","Xiaohong Zhang; Jianming Shen; Yanqing Wang; Yan Qi; Wenjie Liao; Wei Shui; Li Li; Hui Qi; Xiaoyu Yu","An environmental sustainability assessment of China?ôs cement industry based on emergy"
