"","tmp_topic","tmp_posterior[1:20, 2]","abstract","doc_info","keywords","year","publication","authors","title"
"792","Topic_2",0.552631578947368,"Due to the improvements associated with our modern lifestyle, both personal preferences and commercial market value should be considered when undertaking the challenge of new product development. Thus, a crucial research topic is how to design a customized product for consumers. In this study, a feature recognition and shape-design process for basketball sneakers was established that integrated Kansei engineering and artificial neural networks (ANNs), in combination with famous point guards in the National Basketball Association (NBA), as the basis for constructing a topological feature map for sneakers. We used questionnaires to get 20 fans in NBA games to assign a rating value in Kansei adjectives to evaluate 50 basketball shoes and to identify the top 10 NBA point guards. The fans??perspectives combined the psychological and physical scales for the top 10 point guards to establish a gross relationship between sneakers and the point guards. Based on competitive learning in the self organizing map (SOM), the similarities of the inputs from the Kansei perspective concerning NBA point guards and sneakers can be reduced in their dimensions and grouped into six clusters. A back propagation network (BPN) is proposed to verify the mapping of sneakers onto point guards. The results were validated by comparing them with the target neurons based on SOM feature map. A MATLAB program was developed using SOM and BPN algorithms to verify the groups of sneakers accompanying the point guards. Then, the system can categorize the sneakers that match the players. A feature-based, shape-morphing process for the design of a new style of sneaker was implemented. A model to blend the features was constructed in SolidWorks CAD by choosing any two different shapes from the SOM map. This research was used to add the vast variety of shapes and design of sneakers from the selected SOM feature map to help designers create many different styles in a short period of time.","Chung-Chuan Wang, Ching-Hu Yang, Chung-Shing Wang, Teng-Ruey Chang, Kai-Jai Yang, Feature recognition and shape design in sneakers, Computers & Industrial Engineering, Volume 102, December 2016, Pages 408-422, ISSN 0360-8352, http://dx.doi.org/10.1016/j.cie.2016.05.003.


(http://www.sciencedirect.com/science/article/pii/S0360835216301437)","Sneakers; Kansei engineering; Self-organizing map; Back propagation network; Feature recognition; Shape design","2016","Computers & Industrial Engineering","Chung-Chuan Wang; Ching-Hu Yang; Chung-Shing Wang; Teng-Ruey Chang; Kai-Jai Yang","Feature recognition and shape design in sneakers"
"774","Topic_2",0.528571428571429,"Accessible from all over the world, the EC became an indispensable element to our society. It allows the use of electronic systems to exchange products, services and information between the different existent users. During these exchanges, it is very important to assure a good quality of service. However, the enormous expansion of the Internet users push its resources to the maximum of its limits, which provoke, in many cases, an important degradation in its performance. Consequently, it is primordial to analyze the capacity of servers in order to handle heavy workloads that are growing considerably as a function of the number of users. It is, therefore, necessary to conduct performance tests before servers' deployment in order to detect any imperfection and predict their behavior under stress. In this context, this paper present a simplified performance evaluation of the °∞alpha°± version of a negotiation platform called Generic Negotiation Platform (GNP) dated on September 2000. This platform is still under development. Many performance factors could be examined in this evaluation. However, we considered only the response time factor because of its important impact on auctions and negotiations applications. We mostly oriented this study to give us an idea about the variation of the average response time of the server as a function of the number of users and the type of different transactions. We also tried to evaluate the effect of the auctions' rules on the server average response time. We limited our study to the close and open auctions at the second price. This study followed the traditional way of doing performance tests. Therefore, we fixed our test objectives and criterion and then create our own scripts. Once the nature of the workload of the server was specified, we created an adequate benchmark to generate requests to the server. Afterwards, the average response time of each considered transaction was collected. In order to interpret these results properly, we calculated the standard deviation and the coefficient of variation of each set of values.","Charles H√©lou, Rachida Dssouli, Teodor-Gabriel Crainic, Performance testing of a negotiation platform, Information and Software Technology, Volume 44, Issue 5, 1 April 2002, Pages 313-330, ISSN 0950-5849, http://dx.doi.org/10.1016/S0950-5849(01)00215-4.


(http://www.sciencedirect.com/science/article/pii/S0950584901002154)","","2002","Information and Software Technology","Charles H√©lou; Rachida Dssouli; Teodor-Gabriel Crainic","Performance testing of a negotiation platform"
"679","Topic_2",0.527173913043478,"Solar Home System (SHS) based rural electrification has experienced a considerable growth in Bangladesh since the start of the Rural Electrification and Renewable Energy Development Project (REREDP) in 2003. The initial target of 50,000 SHS installations in off-grid areas was achieved within 2.5 years, 3 years ahead of schedule. After achieving a revised target of 200,000 SHSs, ahead of schedule in early 2009, a new target of 1 million SHS installations by 2012 was set. The installation of about 0.5 million systems by March 2010 indicates that the current target may well be achieved before the deadline. The size of the SHS market and its impact on the regeneration of the rural economy make it necessary to investigate the quality and reliability of the installed SHSs, if the continued success of the initiative is to be maintained. This paper reports on the findings from a field-based technical appraisal of SHS installations in Bangladesh. Sixty geographically dispersed installation sites were visited. Physical characteristics of the SHSs and their system components were tested to ascertain compliance with and deviations from the approved specifications. Despite the overwhelming success of the REREDP project, the study revealed various shortcomings. Notable among these are: incompatible and sub-optimal component configurations, faulty installations and a lack of effective quality assurance mechanism. The findings are contextualized and the ways to address the identified shortcomings are discussed.","Shahriar A. Chowdhury, Monjur Mourshed, S.M. Raiyan Kabir, Moududul Islam, Tanvir Morshed, M. Rezwan Khan, Mohammad N. Patwary, Technical appraisal of solar home systems in Bangladesh: A field investigation, Renewable Energy, Volume 36, Issue 2, February 2011, Pages 772-778, ISSN 0960-1481, http://dx.doi.org/10.1016/j.renene.2010.07.027.


(http://www.sciencedirect.com/science/article/pii/S0960148110003514)","Solar home system (SHS); Technical appraisal; Bangladesh; Field investigation","2011","Renewable Energy","Shahriar A. Chowdhury; Monjur Mourshed; S.M. Raiyan Kabir; Moududul Islam; Tanvir Morshed; M. Rezwan Khan; Mohammad N. Patwary","Technical appraisal of solar home systems in Bangladesh: A field investigation"
"734","Topic_2",0.521978021978022,"Objectives Health care delivery is particularly problematic in fragile states often connected with increased incidence of communicable diseases, among them tuberculosis. This article draws upon experiences in tuberculosis control in four fragile states from which four lessons learned were derived. Methods A structured inventory to extract common themes specific for TB control in fragile states was conducted among twelve providers of technical assistance who have worked in fragile states. The themes were applied to the TB control programs of Afghanistan, DR Congo, Haiti and Somalia during the years 2000??006. Results Case notifications and treatment outcomes have increased in all four countries since 2003 (treatment success rates 81??0%). Access to care and case detection however have remained insufficient (case detection rates 39??2%); There are four lessons learned: 1. TB control programs can function in fragile states. 2. National program leadership and stewardship are essential for quality and sustained TB control. 3. Partnerships with non-governmental providers are vital for continuous service delivery; 4. TB control programs in fragile states require consistent donor support. Conclusion Despite challenges in management, coordination, security, logistics and funding, TB control programs can function in fragile states, but face considerable problems in access to diagnosis and treatment and therefore case detection.","Verena Mauch, Diana Weil, Aayid Munim, Francois Boillot, Rudi Coninx, Sevil Huseynova, Clydette Powell, Akihiro Seita, Henriette Wembanyama, Susan van den Hof, Structure and management of tuberculosis control programs in fragile states?îAfghanistan, DR Congo, Haiti, Somalia, Health Policy, Volume 96, Issue 2, July 2010, Pages 118-127, ISSN 0168-8510, http://dx.doi.org/10.1016/j.healthpol.2010.01.003.


(http://www.sciencedirect.com/science/article/pii/S0168851010000059)","Afghanistan; DR Congo; Haiti; Somalia; Tuberculosis; Health systems","2010","Health Policy","Verena Mauch; Diana Weil; Aayid Munim; Francois Boillot; Rudi Coninx; Sevil Huseynova; Clydette Powell; Akihiro Seita; Henriette Wembanyama; Susan van den Hof; Structure and management of tuberculosis control programs in fragile states?îAfghanistan; DR Congo; Haiti","Somalia"
"747","Topic_2",0.519125683060109,"The California tomato processing industry produced circa 388,856¬†t of tomato pomace in 2014. While currently used for animal feed, tomato pomace could be utilized for biosolarization. Primary Energy Demand (PED) and Global Warming Potential (GWP) equivalent emissions were calculated for two valorization pathways: (i) feed for cattle; and (ii) biosolarization. In order to make these two valorization pathways comparable three management options were analyzed whereby each part of the system was satisfied, i.e. a pest management sub-system and a cattle feed sub-system. The management options were (1) tomato pomace used for cattle feed and soil pest control using fumigant Telone II and herbicide glyphosate; (2) tomato pomace used for cattle feed and soil pest control using solarization; (3) alternative cattle feed (cottonseed, canola pellets and wheat straw) and soil pest control using biosolarization with tomato pomace. Options 2 and 3 result in a reduction of GWP and PED. Among management options, the GWP ranged from 64??8¬†kg CO2-e and 1502??250¬†MJ for PED per t of pomace. The majority of impacts were beyond the tomato processors??immediate control, therefore encouraging the diversion of tomato pomace to biosolarization may be desirable. Total savings per annum for biosolarization could be as large as 7.7¬†M¬†kg CO2-e and 203,000¬†GJ annually.","Thomas L. Oldfield, Yigal Achmon, Kristen M. Perano, Ruth M. Dahlquist-Willard, Jean S. VanderGheynst, James J. Stapleton, Christopher W. Simmons, Nicholas M. Holden, A life cycle assessment of biosolarization as a valorization pathway for tomato pomace utilization in California, Journal of Cleaner Production, Volume 141, 10 January 2017, Pages 146-156, ISSN 0959-6526, http://dx.doi.org/10.1016/j.jclepro.2016.09.051.


(http://www.sciencedirect.com/science/article/pii/S0959652616313920)","Pest control; Cattle feed; Solarization; Circular economy; Bioeconomy; Tomato processor","2017","Journal of Cleaner Production","Thomas L. Oldfield; Yigal Achmon; Kristen M. Perano; Ruth M. Dahlquist-Willard; Jean S. VanderGheynst; James J. Stapleton; Christopher W. Simmons; Nicholas M. Holden","A life cycle assessment of biosolarization as a valorization pathway for tomato pomace utilization in California"
"749","Topic_2",0.506329113924051,"Ground penetrating radar (GPR) is one of the most promising and effective non-destructive testing techniques (NDTs), particularly for the interpretation of the soil properties. Within the framework of international Agencies dealing with the standardization of NDTs, the American Society for Testing and Materials (ASTM) has published several standard test methods related to GPR, none of which is focused on a detailed analysis of the system performance, particularly in terms of precision and bias of the testing variable under consideration. This work proposes a GPR signal processing methodology, calibrated and validated on the basis of a consistent amount of data collected by means of laboratory-scale tests, to assess the performance of the above standard test methods for GPR systems. The (theoretical) expressions of the bias and variance of the estimation error are here investigated by a reduced Taylor's expansion up to the second order. Therefore, a closed form expression for theoretically tuning the optimal threshold according to a fixed target value of the GPR signal stability is proposed. Finally, the study is extended to GPR systems with different antenna frequencies to analyze the specific relationship between the frequency of investigation, the optimal thresholds, and the signal stability.","Francesco Benedetto, Fabio Tosti, A signal processing methodology for assessing the performance of ASTM standard test methods for GPR systems, Signal Processing, Volume 132, March 2017, Pages 327-337, ISSN 0165-1684, http://dx.doi.org/10.1016/j.sigpro.2016.06.030.


(http://www.sciencedirect.com/science/article/pii/S0165168416301414)","Ground Penetrating Radar; GPR calibration; Performance evaluation; Civil engineering applications","2017","Signal Processing","Francesco Benedetto; Fabio Tosti","A signal processing methodology for assessing the performance of ASTM standard test methods for GPR systems"
"666","Topic_2",0.5,"This paper proposes a novel measurement scheme of 3D shape similarity that integrates D2 Shape Descriptor and Negative Feature Decomposition (NFD). Using NFD, the scheme firstly converts a 3D mechanical part into a tree structure of geometrical primitives decomposed from the part model, namely Negative Feature Tree (NFT). The D2 shape descriptions of these primitives are then produced for further similarity assessments. We assess the shape similarity on a level-by-level basis between the NFTs of a query part and a candidate part. The weighted sum of the similarity values computed on each level is then used as a measure of the overall similarity between the two parts. Our approach combines the simplicity of D2 shape description while overcoming its insensitivity to negative features with NFD. It performs more consistently than the method of Convex Hull Difference (CHD). A comparison with the assessment results using D2 and CHD demonstrates the effectiveness of the new scheme.","Han-Chung Cheng, Cheng-Hung Lo, Chih-Hsing Chu, Yong Se Kim, Shape similarity measurement for 3D mechanical part using D2 shape distribution and negative feature decomposition, Computers in Industry, Volume 62, Issue 3, April 2011, Pages 269-280, ISSN 0166-3615, http://dx.doi.org/10.1016/j.compind.2010.09.001.


(http://www.sciencedirect.com/science/article/pii/S0166361510001296)","3D shape similarity; Mechanical part; Negative feature decomposition; D2; Part search","2011","Computers in Industry","Han-Chung Cheng; Cheng-Hung Lo; Chih-Hsing Chu; Yong Se Kim","Shape similarity measurement for 3D mechanical part using D2 shape distribution and negative feature decomposition"
"431","Topic_2",0.497142857142857,"This paper aims to present a modeling of bike sharing demand at station level in the city of Lyon. Robust linear regression models were used in order to predict the flows of each station. The data used in this project consists of over 6 million bike sharing trips recorded in 2011. The built environment variables used in the model are determined in a buffer zone of 300 meters around each bike sharing station. In order to estimate the bike sharing flow, we use the method of linear regression during the peak periods of a weekday. The results show that bike sharing is principally used for commuting purposes by long term subscribers while short term subscriber's trips purposes are more varied. The combination between bike sharing and train seems to be an important inter-modality. An interesting finding is that student is an important user of bike sharing. We found that there were different types of bikesharing usage which are influenced by socio-economic factors depending on the period within the day and type of subscribers. The present findings could be useful for others cities which want to adopt a bikesharing system and also for a better planning and operation of existing systems. Further, the solutions to encourage the use of bikesharing will be various depending on type of subscribers. The approach in this paper can be useful for estimating car-sharing demand.","Tien Dung Tran, Nicolas Ovtracht, Bruno Faivre d?ôArcier, Modeling Bike Sharing System using Built Environment Factors, Procedia CIRP, Volume 30, 2015, Pages 293-298, ISSN 2212-8271, http://dx.doi.org/10.1016/j.procir.2015.02.156.


(http://www.sciencedirect.com/science/article/pii/S2212827115004692)","bike-sharing system; sustainable mobility; transport modeling; spatial analysis","2015","Procedia CIRP","Tien Dung Tran; Nicolas Ovtracht; Bruno Faivre d?ôArcier","Modeling Bike Sharing System using Built Environment Factors"
"443","Topic_2",0.488188976377953,"In this paper, we propose a new method called 2-probabilities focused combination for combining information about user preferences on products or services in recommender systems based on Dempster?ìShafer theory. Regarding this method, in focal sets of mass functions representing user preferences, focal elements with probabilities in top two highest ones are retained and the remaining focal elements are considered as noise and then transferred to the whole set element. To demonstrate the advantages of the new method, a baseline known as 2-points focused combination is selected for performance comparison in a range of experiments using Movielens and Flixster data sets. According to the results of experiments, the new method is more effective in accuracy of recommendations and comparable in computational time. Also, the new method is capable of overcoming the weakness of the baseline because of the ability to generate stable results.","Van-Doan Nguyen, Van-Nam Huynh, Two-probabilities focused combination in recommender systems, International Journal of Approximate Reasoning, Volume 80, January 2017, Pages 225-238, ISSN 0888-613X, http://dx.doi.org/10.1016/j.ijar.2016.09.005.


(http://www.sciencedirect.com/science/article/pii/S0888613X16301578)","Information fusion; Uncertain reasoning; Dempster?ìShafer theory; Recommender systems; Collaborative filtering","2017","International Journal of Approximate Reasoning","Van-Doan Nguyen; Van-Nam Huynh","Two-probabilities focused combination in recommender systems"
"216","Topic_2",0.483870967741935,"Maintenance service is the most important part in industrial product-service system (iPSS). To enhance the proactiveness of maintenance service, the failure time of product need to be predicted. This study provides insight into how the maintenance time can be predicted accurately for the service decision-making of IPSS based on the historical failure time data, avoiding the dependence on mechanical condition monitoring. An improved grey prediction model is introduced to obtain a predictive interval of maintenance service time which is used as basis for making a decision of proactive maintenance service. The method is applied in an instance of maintenance service for agricultural machinery. In three examples of different types of agricultural machinery, the predicted intervals of maintenance time are given and the fitted values have high accordance with the real ones. The result shows that this approach can be used effectively to predict production failure time. Moreover, the output results of this approach can provide the necessary support to make a decision for proactive maintenance service without the dependence on mechanical condition monitoring in a reliable way.","Yuji Liu, Yaoguang Hu, Rui Zhou, Jingqian Wen, An Approach Based on Improved Grey Model for Predicting Maintenance Time of IPS2, Procedia CIRP, Volume 47, 2016, Pages 204-209, ISSN 2212-8271, http://dx.doi.org/10.1016/j.procir.2016.03.047.


(http://www.sciencedirect.com/science/article/pii/S2212827116300178)","maintenance service; IPSS; time prediction; grey theory","2016","Procedia CIRP","Yuji Liu; Yaoguang Hu; Rui Zhou; Jingqian Wen","An Approach Based on Improved Grey Model for Predicting Maintenance Time of IPS2"
"524","Topic_2",0.482142857142857,"Regression is a common method to calculate relationships between variables. Quantile regression extends the calculation to the coefficients of various quantiles, providing a more complete overview. In addition, quantile forecasting models forecast coefficients. This study proposes a new algorithm to calculate the quantile confidence intervals of the in-sample data to forecast the coefficients of the out-of-sample data. The algorithm analyzes ICT data for 78 countries between 1999 and 2010. Results show that the algorithm provides valid forecasting results and outperforms previous studies. These quantile confidence intervals can also forecast the independent variables' impact trends on the dependent variable. The algorithm is applicable to different domains.","Kun-Huang Huarng, Tiffany Hui-Kuang Yu, Forecasting ICT development through quantile confidence intervals, Journal of Business Research, Volume 68, Issue 11, November 2015, Pages 2295-2298, ISSN 0148-2963, http://dx.doi.org/10.1016/j.jbusres.2015.06.014.


(http://www.sciencedirect.com/science/article/pii/S0148296315002428)","Information criterion; Quantile; Regression; Time series","2015","Journal of Business Research","Kun-Huang Huarng; Tiffany Hui-Kuang Yu","Forecasting ICT development through quantile confidence intervals"
"735","Topic_2",0.479289940828402,"We develop an improved approach to evaluate car sharing options under uncertain environments with the combination of Fuzzy Analytic Hierarchy Process (F-AHP) and Fuzzy Technique for Order Preference by Similarity to Ideal Solution (F-TOPSIS), which consists of three steps. In the first step, we propose a SCUMN (Specific, Comprehensive, Understandable, Measurable, and Neutral) methodology to identify appropriate indicators and obtain a final list of 24 indicators according to their relevance to car sharing options. In the second step, we determine the weight of each indicator with F-AHP and conduct consistency check of the comparison matrix of selected indicators. In the third step, comparison of different options is performed with selected indicators and F-TOPSIS. A case study is provided to validate the proposed approach. Twenty-four indicators are identified to evaluate five different car sharing options and rank them according to their closeness coefficients in decreasing order. And thirty-one sensitivity analysis experiments are conducted to figure out the influence of indicators on decision making. The experimental results show that the proposed approach is capable of evaluating car sharing options with uncertainty and vagueness. F-AHP is able to determine the weight for each selected indicator and F-TOPSIS demonstrates its advantage in comparing potential options.","Min Qu, Suihuai Yu, Mingjiu Yu, An improved approach to evaluate car sharing options, Ecological Indicators, Volume 72, January 2017, Pages 686-702, ISSN 1470-160X, http://dx.doi.org/10.1016/j.ecolind.2016.07.018.


(http://www.sciencedirect.com/science/article/pii/S1470160X16304101)","Fuzzy analytic hierarchy process; Fuzzy technique for order preference by similarity to ideal solution; Car sharing; Indicator; Sensitivity analysis","2017","Ecological Indicators","Min Qu; Suihuai Yu; Mingjiu Yu","An improved approach to evaluate car sharing options"
