"","tmp_topic","tmp_posterior[1:20, 2]","abstract","doc_info","keywords","year","publication","authors","title"
"786","Topic_3",0.51304347826087,"This paper analyzes the influences of personal mastery on organizational performance, both directly and indirectly through the dynamic capabilities of organizational learning and innovation. Although these indirect interrelations are very important for improving organizational performance, they are not usually explored in research. We confirm these influences empirically in both large firms and SMEs, basing our research on a sample of 401 Spanish firms. The results reveal that in both types of firms: (1) personal mastery influences organizational performance directly and indirectly through organizational learning and innovation; (2) organizational learning influences organizational performance positively, both directly and indirectly through organizational innovation; (3) organizational innovation influences organizational performance positively.","V√≠ctor J. Garc√≠a-Morales, Francisco Javier Llor√©ns-Montes, Antonio J. Verd√∫-Jover, Influence of personal mastery on organizational performance through organizational learning and innovation in large firms and SMEs, Technovation, Volume 27, Issue 9, September 2007, Pages 547-568, ISSN 0166-4972, http://dx.doi.org/10.1016/j.technovation.2007.02.013.


(http://www.sciencedirect.com/science/article/pii/S0166497207000375)","Organizational innovation; Organizational learning; Personal mastery; Performance; Size","2007","Technovation","V√≠ctor J. Garc√≠a-Morales; Francisco Javier Llor√©ns-Montes; Antonio J. Verd√∫-Jover","Influence of personal mastery on organizational performance through organizational learning and innovation in large firms and SMEs"
"196","Topic_3",0.511278195488722,"This special issue presents studies on innovation and diffusion of high-tech products, services, and systems (high-tech for short). High-tech are core components of marketing, innovation, entrepreneurship, and diffusion. High-tech may affect consumer behaviors. High-tech can boost innovation in tourism, services, branding, and products. Entrepreneurship highly relates to innovation. Strategies and forecasting techniques can facilitate high-tech diffusion. This special issue selects articles from 2014 Global Innovation and Knowledge Academy (GIKA)?îAsia/Pacific Conference, December 5??, Feng Chia University, Taiwan. The GIKA conference selects high-quality conference articles for publication in a special issue of the Journal of Business Research. After double-blind reviews and revisions, 17 conference articles appear in the 2015 special issue, together with this editorial.","Kun-Huang Huarng, Tiffany Hui-Kuang Yu, Wenhsiang Lai, Innovation and diffusion of high-tech products, services, and systems, Journal of Business Research, Volume 68, Issue 11, November 2015, Pages 2223-2226, ISSN 0148-2963, http://dx.doi.org/10.1016/j.jbusres.2015.06.001.


(http://www.sciencedirect.com/science/article/pii/S0148296315002295)","Entrepreneurship; Fuzzy set/qualitative comparative analysis; Marketing; Social media; Social network","2015","Journal of Business Research","Kun-Huang Huarng; Tiffany Hui-Kuang Yu; Wenhsiang Lai; Innovation and diffusion of high-tech products; services","and systems"
"525","Topic_3",0.494845360824742,"AbstractPurpose This study aims to investigate how customer co-creation affects the performance of service innovation through the operant resources. Design/methodology/approach This study uses survey methodology to examine a research model with six hypotheses. Data from 149 high-tech firms are analyzed using structural equation modeling. Findings The dialogic co-creation affects customer relationship strength (relational resource), valuation of knowledge (informational resource), and capability of customization (organizational resource), facilitating service innovation. Research limitations/implications Findings offer novel insights into how service innovation co-creation takes place within a dialogic context leading to organizational changes. The results clarify the influences of operant resources on service innovation and indicate that companies should emphasize dialogic communication with customer in developing service innovation. Practical implications Managers have to understand that co-creation is an effective approach in business to stretch business boundaries, and that customers are the crucial external party that co-creates. According to the mutual influences of co-creation, businesses not only can exploit knowledge from customers but also strengthen the relationship bond with them. For the investment programs on service innovation of businesses, managers should allocate budget to relation-specific investments and knowledge acquisition with customers. Originality/value This research model, guided by the R-A theory and S-D logic, might serve as a template for scholars exploring issues of service innovation. Findings of this study identify important implications that benefit service innovation research in several ways.","Jung-Kuei Hsieh, Yi-Ching Hsieh, Dialogic co-creation and service innovation performance in high-tech companies, Journal of Business Research, Volume 68, Issue 11, November 2015, Pages 2266-2271, ISSN 0148-2963, http://dx.doi.org/10.1016/j.jbusres.2015.06.009.


(http://www.sciencedirect.com/science/article/pii/S0148296315002374)","Operant resource; Service innovation; Resource-advantage theory; Service-dominant logic; Customer co-creation","2015","Journal of Business Research","Jung-Kuei Hsieh; Yi-Ching Hsieh","Dialogic co-creation and service innovation performance in high-tech companies"
"636","Topic_3",0.494117647058824,"Clustering is one of the key drivers for regional economic growth. Development of clusters is a dynamic process shaped by a variety of internal and external factors such as availability of skilled labor, presence of functioning networks and partnerships, technological changes, and market competition, etc. As a result, the patterns of cluster growth may differ from one another. Although each cluster is unique in some way, previous research has attempted to identify few simplified models of evolution of clusters. In this study, we briefly reviewed the literature on a variety of models of clusters. Based on these models, we investigated 15 hi-performing metropolitan-based clusters in the United States, covering communications equipment manufacturing, information technology, and biopharmaceutical industries, in order to find out the similarities and differences between real-world clusters. Specifically, by examining the composition of these high-tech clusters, we attempted to find out the following: 1) What are the typologies of these technology clusters? 2) Whether different industries tend to support different cluster typologies? and 3) How do clusters change their typologies over time? Our analysis results suggest that the real-world clusters rarely feature any single type of typology; a mixed type of typology is much more prevalent in reality.","Jiang He, M. Hosein Fallah, The typology of technology clusters and its evolution ??Evidence from the hi-tech industries, Technological Forecasting and Social Change, Volume 78, Issue 6, July 2011, Pages 945-952, ISSN 0040-1625, http://dx.doi.org/10.1016/j.techfore.2011.01.005.


(http://www.sciencedirect.com/science/article/pii/S0040162511000084)","Technology clusters; Agglomeration; Patent analysis; Regional planning","2011","Technological Forecasting and Social Change","Jiang He; M. Hosein Fallah","The typology of technology clusters and its evolution ??Evidence from the hi-tech industries"
"447","Topic_3",0.493421052631579,"Sustainable business is characterized by its facets to balance triple bottom lines (i.e., profit, planet, and people). In sustainable business design, it is crucial to consider interaction between the core business and external environment, which does not seem to influence the profit of the core business but necessary to explain their intended environmental and social value proposition. To construct a particular model of sustainable business, the paper conducted a survey on the study of business models and, in particular, sustainable business models (e.g., eco-innovations, sustainable innovations, product-service systems). The survey focuses on how the study models external environment and its influences on the core business characterized by ?úexternality?? Through discussion on the findings of the literature review, three key issues to be addressed for constructing sustainable business model are identified: taxonomy of externality, identification of a set of models (i.e., aspect model), and identification of interrelationship among them. First and second issues clarify particular aspects of externality. By considering third issue, the designer is able to design sustainable business by integrating these aspects.","Shinsuke Kondoh, Hitoshi Komoto, Yusuke Kishita, Shinichi Fukushige, Toward a Sustainable Business Design: A Survey, Procedia CIRP, Volume 15, 2014, Pages 367-372, ISSN 2212-8271, http://dx.doi.org/10.1016/j.procir.2014.06.094.


(http://www.sciencedirect.com/science/article/pii/S2212827114005174)","Sustainable business; business model; externality; aspect model","2014","Procedia CIRP","Shinsuke Kondoh; Hitoshi Komoto; Yusuke Kishita; Shinichi Fukushige","Toward a Sustainable Business Design: A Survey"
"754","Topic_3",0.480519480519481,"The aim of this article is to explore how ecodesign dilemmas contribute to a firm's ecodesign evolution. The article achieves this through empirical research into a process of ecodesign decision-making in a single firm. The study spans a timeframe of nine years. The article describes how recognising and dealing with ecodesign dilemmas fuels cycles of learning, leading the firm towards business model innovation. The study classifies a unique set of ecodesign dilemmas: hierarchies; tensions; contradictions; and oversights. Through this classification, we show how firms need to adopt a unified approach combining operational (ecodesign principles approach), tactical (ecodesign management processes) and strategic actions (business model innovation), to systematically manage ecodesign dilemmas. To support this, the article presents a framework describing key actions for operational, tactical and strategic ecodesign decision-making and the types of ecodesign dilemmas typical to each approach. Through this study, we show that the business model is critical to inform effective ecodesign decision-making and illustrate how design can drive firms towards sustainable change, from the bottom up.","Sharon M. Prendeville, Frank O'Connor, Nancy M.P. Bocken, Conny Bakker, Uncovering ecodesign dilemmas: A path to business model innovation, Journal of Cleaner Production, Available online 16 November 2016, ISSN 0959-6526, http://dx.doi.org/10.1016/j.jclepro.2016.11.095.


(http://www.sciencedirect.com/science/article/pii/S0959652616319400)","Ecodesign; Ecodesign maturity; Dilemmas; Trade-offs; Business model innovation","2016","Journal of Cleaner Production","Sharon M. Prendeville; Frank O'Connor; Nancy M.P. Bocken; Conny Bakker","Uncovering ecodesign dilemmas: A path to business model innovation"
"604","Topic_3",0.478787878787879,"On the basis of intended marketing strategy plans, firms design administrative systems to support strategy implementation. In increasingly turbulent business environments?îcharacterized by complexity, scarce resources, and escalating competitive opportunities and threats?îfirms are forced to alter intended and realize emergent strategies more frequently than ever before. The eventualities of realized marketing strategies may lead to misalignments between the strategy and the existing administrative system designed to support it. To examine performance implications of such misalignments we use Slater and Olson's (2001) taxonomy of marketing strategies. We distinguish between intended and realized plans and we propose an administrative system framework of structural (i.e., centralization, formalization, and specialization) and dynamic (i.e., interdepartmental connectedness and strategic control mechanisms) parameters for the effective implementation of realized strategies. We propose three-way interactions between realized marketing strategies and the dynamic parameters of the system. Research hypotheses on performance implications and responses from 215 marketing executives show performance differences across strategy types and (mis)alignments of the administrative system. Our findings confirm three-way interactions among strategy types, interdepartmental connectedness, and control mechanisms for all realized strategy types.","Simos Chari, George Balabanis, Matthew J. Robson, Stanley Slater, Alignments and misalignments of realized marketing strategies with administrative systems: Performance implications, Industrial Marketing Management, Available online 13 December 2016, ISSN 0019-8501, http://dx.doi.org/10.1016/j.indmarman.2016.11.002.


(http://www.sciencedirect.com/science/article/pii/S0019850116302917)","Misalignment; Performance; Realized marketing strategy; Structure; Strategic control","2016","Industrial Marketing Management","Simos Chari; George Balabanis; Matthew J. Robson; Stanley Slater","Alignments and misalignments of realized marketing strategies with administrative systems: Performance implications"
"371","Topic_3",0.475308641975309,"Co-creating value is central to providing product?ìservice solutions. The present study contributes to a better understanding of the transition process from traditional transaction-oriented roles to future co-creation roles within provider?ìcustomer relationships. Our inductive analysis of cross-comparative case studies, including eight provider?ìcustomer relationships, identifies significant role ambiguities among actors involved in this transition. In addition to identifying challenges, we explain how relational coping strategies help the partners manage the presence of role ambiguities during the value co-creation process. Notably, three types of role ambiguities (vague role expectations, unclear role descriptions and uncertain role scripts) often serve as barriers to co-creating value across different phases of the value co-creation process and require different relational response strategies (role clarification, role redefinition and role adaption) to cope with unclear expectations, responsibilities and demands. The present study contributes to the emerging literature on value co-creation by underlining the role dynamics in provider and customer relationships during the co-creation process of product?ìservice solutions.","David R√∂nnberg Sj√∂din, Vinit Parida, Joakim Wincent, Value co-creation process of integrated product-services: Effect of role ambiguities and relational coping strategies, Industrial Marketing Management, Volume 56, July 2016, Pages 108-119, ISSN 0019-8501, http://dx.doi.org/10.1016/j.indmarman.2016.03.013.


(http://www.sciencedirect.com/science/article/pii/S0019850116300451)","Product-service system; Service-dominant logic; Servitization; Service innovation; Integrated solutions","2016","Industrial Marketing Management","David R√∂nnberg Sj√∂din; Vinit Parida; Joakim Wincent","Value co-creation process of integrated product-services: Effect of role ambiguities and relational coping strategies"
"677","Topic_3",0.472727272727273,"Business models for open data have emerged in response to the economic opportunities presented by the increasing availability of open data. However, scholarly efforts providing elaborations, rigorous analysis and comparison of open data models are very limited. This could be partly attributed to the fact that most discussions on Open Data Business Models (ODBMs) are predominantly in the practice community. This shortcoming has resulted in a growing list of ODBMs which, on closer examination, are not clearly delineated and lack clear value orientation. This has made the understanding of value creation and exploitation mechanisms in existing open data businesses difficult and challenging to transfer. Following the Design Science Research (DSR) tradition, we developed a 6-Value (6-V) business model framework as a design artifact to facilitate the explication and detailed analysis of existing ODBMs in practice. Based on the results from the analysis, we identify business model patterns and emerging core value disciplines for open data businesses. Our results not only help streamline existing ODBMs and help in linking them to the overall business strategy, but could also guide governments in developing the required capabilities to support and sustain the business models.","Fatemeh Ahmadi Zeleti, Adegboyega Ojo, Edward Curry, Exploring the economic value of open government data, Government Information Quarterly, Volume 33, Issue 3, July 2016, Pages 535-551, ISSN 0740-624X, http://dx.doi.org/10.1016/j.giq.2016.01.008.


(http://www.sciencedirect.com/science/article/pii/S0740624X16300077)","Open government; Open Data Business Models; Open data industry; Values disciplines; Business models; Business model framework","2016","Government Information Quarterly","Fatemeh Ahmadi Zeleti; Adegboyega Ojo; Edward Curry","Exploring the economic value of open government data"
"560","Topic_3",0.472222222222222,"The efforts to address markets as socio-technical orders have hitherto focused on the role of marketing in shaping demand. However, in many markets the role of purchasing is just as important. This paper uses a case study to examine how a single buying company can attempt to shape an emerging market through its purchasing practices. As a result, the study identifies five types of market-shaping actions. Within each action type, the market-shaping behavior of a buyer in an emerging market can be very diverse and include internal actions as well as actions aimed at influencing other market actors. While agency on the purchasing side is often associated with large size organizations, namely government and public sector agencies, our case study shows that agencies on the purchasing sides can be deployed in a variety of ways rather than merely through raw bargaining power. The findings indicate that buying firms do not simply adjust their own purchasing processes according to existing offerings, but actively attempt to drive market evolution in particular directions.","Pauliina Ulkuniemi, Luis Araujo, Jaana T√§htinen, Purchasing as market-shaping: The case of component-based software engineering, Industrial Marketing Management, Volume 44, January 2015, Pages 54-62, ISSN 0019-8501, http://dx.doi.org/10.1016/j.indmarman.2014.10.007.


(http://www.sciencedirect.com/science/article/pii/S0019850114001746)","Market studies; Purchasing and supply management; Market structures; Supply markets","2015","Industrial Marketing Management","Pauliina Ulkuniemi; Luis Araujo; Jaana T√§htinen","Purchasing as market-shaping: The case of component-based software engineering"
"481","Topic_3",0.470588235294118,"This study examines factors that explain the creation of university spin-offs. The study focuses on mechanisms that technology transfer offices (TTOs) and universities employ to foster spin-offs. These mechanisms include technology transfer activities that support spin-offs, normative frameworks, support infrastructures (i.e., business incubators and science parks), and TTO staff's specialist technical skills. The analysis also differentiates between public and private universities. Spin-offs belong to one or more of the following groups: spin-offs with support from the university's TTO, spin-offs operating under a license agreement, and spin-offs in which the TTO or university holds equity. Qualitative comparative analysis (QCA) of 2011 data from 63 Spanish universities (46 public and 17 private) identifies recipes of antecedent conditions that effectively foster spin-offs. Results show that no unique combination of antecedent conditions yields more university spin-offs than any other does. This finding indicates that several strategies can successfully lead to academic entrepreneurship.","Jasmina Berbegal-Mirabent, Domingo Enrique Ribeiro-Soriano, Jos√© Luis S√°nchez Garc√≠a, Can a magic recipe foster university spin-off creation?, Journal of Business Research, Volume 68, Issue 11, November 2015, Pages 2272-2278, ISSN 0148-2963, http://dx.doi.org/10.1016/j.jbusres.2015.06.010.


(http://www.sciencedirect.com/science/article/pii/S0148296315002386)","University spin-offs; Technology transfer; Fuzzy-set QCA; Crisp-setQCA","2015","Journal of Business Research","Jasmina Berbegal-Mirabent; Domingo Enrique Ribeiro-Soriano; Jos√© Luis S√°nchez Garc√≠a","Can a magic recipe foster university spin-off creation?"
"201","Topic_3",0.468181818181818,"The concept of improvisation is discussed in management literature as a promising mechanism and design principle for an organization's capacity for learning, adaptability and innovation. However, a specific form of improvisation for coping with the duality of production and service has not yet been applied to the servitization of manufacturing or PSS. This paper introduces a specific form of semi-structured improvisational learning related to PSS-oriented organizations. It introduces an organizational design principle of desired and accepted improvisational actions for highly individualized customer solutions. This semi-structured form of improvisational learning separates PSS from manufacturing-oriented organizations, where improvisation is rather a phenomenon of resistive actions that trigger undesired deviations. By emphasizing the increasing importance of improvisation and improvisational learning as a desirable and acceptable principle of action, it is argued that this rather paradigmatic shift demands specific capabilities from individual actors in PSS. These individual capabilities are summarized in this paper as learning-oriented capabilities that unfold a dynamic balance of generative and adaptive learning activities in PSS. As this specific pattern of individual capabilities is less cultivated in pure manufacturing, a game-based training and learning approach is introduced which is designed to accompany individual actors during the servitization process. The game-based learning scenario focuses on the development of individual improvisational capabilities as a mediating force in the dynamic triangle of customer, production and service. In conclusion, the literature review of this paper contributes to the scientific community by framing the servitization of manufacturing with the concept of improvisation as a coping strategy for the dynamics and ambiguity in PSS. Furthermore, a training and development approach is specified that aims at equipping individual actors with capabilities of improvisation and improvisational learning as prerequisites for the operation of highly individualized PSS. This training approach is also intended to be applicable for practitioners.","Thomas S√º√üe, Improvisation as a Prerequisite for the Dynamic Interplay of Production and Service in PSS: Insights of an Organizational Design Principle and a Game-based Learning Approach, Procedia CIRP, Volume 30, 2015, Pages 366-371, ISSN 2212-8271, http://dx.doi.org/10.1016/j.procir.2015.02.186.


(http://www.sciencedirect.com/science/article/pii/S2212827115005028)","PSS; product-service systems; product; service; Improvisation; improvisational learning; individual learning; contradictions; tensions; organization","2015","Procedia CIRP","Thomas S√º√üe","Improvisation as a Prerequisite for the Dynamic Interplay of Production and Service in PSS: Insights of an Organizational Design Principle and a Game-based Learning Approach"
